[
 {
  "id": "ACT-0001",
  "kind": "action-type",
  "name": "property",
  "title": "Daten / Eigenschaft setzen",
  "category": "runtime-action",
  "description": "Setzt eine oder mehrere Datenquellen (Variablen oder Objekteigenschaften) auf neue Werte.",
  "status": {
   "dev": "implementiert",
   "test": "nicht getestet",
   "doc": "entwurf"
  },
  "parameters": [
   {
    "name": "changes",
    "label": "Zuweisungen",
    "type": "keyvalue",
    "hint": "Wähle eine Datenquelle (links) und weise einen Wert (rechts) zu."
   }
  ],
  "flags": {},
  "sources": {
   "code": [
    "src/runtime/ActionRegistry.ts",
    "src/runtime/actions/handlers/"
   ],
   "docs": [
    "docs/inventory/action-metadata.json",
    "docs/reference/actions.md"
   ]
  },
  "version": {
   "lastChecked": "2026-10-17",
   "extractedAt": "2026-10-18T10:54:39.412Z",
   "contentHash": "sha256:1b0d0e198fd136e7"
  },
  "provenance": {
   "method": [
    "registry-extract"
   ],
   "confidence": "verified",
   "facts": {
    "registration": "verified",
    "parameters": "verified",
    "flags": "verified"
   }
  }
 },
 {
  "id": "ACT-0002",
  "kind": "action-type",
  "name": "action",
  "title": "Daten / Eigenschaft setzen",
  "category": "runtime-action",
  "description": "Alias für property — ändert Datenquellen.",
  "status": {
   "dev": "implementiert",
   "test": "nicht getestet",
   "doc": "entwurf"
  },
  "parameters": [
   {
    "name": "changes",
    "label": "Zuweisungen",
    "type": "keyvalue",
    "hint": "Wähle eine Datenquelle (links) und weise einen Wert (rechts) zu."
   }
  ],
  "flags": {
   "isAlias": true
  },
  "sources": {
   "code": [
    "src/runtime/ActionRegistry.ts",
    "src/runtime/actions/handlers/"
   ],
   "docs": [
    "docs/inventory/action-metadata.json",
    "docs/reference/actions.md"
   ]
  },
  "version": {
   "lastChecked": "2026-10-17",
   "extractedAt": "2026-10-18T10:54:39.412Z",
   "contentHash": "sha256:c80c4eac7792c374"
  },
  "provenance": {
   "method": [
    "registry-extract"
   ],
   "confidence": "verified",
   "facts": {
    "registration": "verified",
    "parameters": "verified",
    "flags": "verified"
   }
  }
 },
 {
  "id": "ACT-0003",
  "kind": "action-type",
  "name": "set_child_property",
  "title": "Kind-Eigenschaft ändern",
  "category": "runtime-action",
  "description": "Sucht ein Kind-Element im TGroupPanel über dessen Namen und ändert dessen Eigenschaften.",
  "status": {
   "dev": "implementiert",
   "test": "nicht getestet",
   "doc": "entwurf"
  },
  "parameters": [
   {
    "name": "target",
    "label": "Eltern-Objekt (TGroupPanel)",
    "type": "object",
    "source": "objects",
    "allowVariableBinding": true,
    "hint": "Oft %Self% oder ${Var} mit der ID des gespawnten Templates"
   },
   {
    "name": "childName",
    "label": "Kind Name",
    "type": "string",
    "hint": "Name des zu modifizierenden Kind-Elements im Template"
   },
   {
    "name": "changes",
    "label": "Änderungen (JSON)",
    "type": "json",
    "hint": "Beispiel: { \"text\": \"Neuer Text\" }"
   }
  ],
  "flags": {},
  "sources": {
   "code": [
    "src/runtime/ActionRegistry.ts",
    "src/runtime/actions/handlers/"
   ],
   "docs": [
    "docs/inventory/action-metadata.json",
    "docs/reference/actions.md"
   ]
  },
  "version": {
   "lastChecked": "2026-10-17",
   "extractedAt": "2026-10-18T10:54:39.412Z",
   "contentHash": "sha256:15869ea11a8a4c9d"
  },
  "provenance": {
   "method": [
    "registry-extract"
   ],
   "confidence": "verified",
   "facts": {
    "registration": "verified",
    "parameters": "verified",
    "flags": "verified"
   }
  }
 },
 {
  "id": "ACT-0004",
  "kind": "action-type",
  "name": "variable",
  "title": "Variable lesen / setzen",
  "category": "runtime-action",
  "description": "Liest einen Wert aus einer Quelle (Objekt-Eigenschaft, Wert oder andere Variable) und speichert ihn in einer Ziel-Variable.",
  "status": {
   "dev": "implementiert",
   "test": "nicht getestet",
   "doc": "entwurf"
  },
  "parameters": [
   {
    "name": "variableName",
    "label": "Ziel-Variable",
    "type": "variable",
    "source": "variables"
   },
   {
    "name": "value",
    "label": "Einfacher Wert (z.B. 555)",
    "type": "string",
    "placeholder": "Literal oder ${var}"
   },
   {
    "name": "source",
    "label": "(oder) Quell-Objekt / Variable",
    "type": "object",
    "source": "objects"
   },
   {
    "name": "sourceProperty",
    "label": "(oder) Eigenschaft (optional)",
    "type": "string",
    "placeholder": "z.B. text oder value"
   }
  ],
  "flags": {},
  "sources": {
   "code": [
    "src/runtime/ActionRegistry.ts",
    "src/runtime/actions/handlers/"
   ],
   "docs": [
    "docs/inventory/action-metadata.json",
    "docs/reference/actions.md"
   ]
  },
  "version": {
   "lastChecked": "2026-10-17",
   "extractedAt": "2026-10-18T10:54:39.412Z",
   "contentHash": "sha256:06cdf57049178a0b"
  },
  "provenance": {
   "method": [
    "registry-extract"
   ],
   "confidence": "verified",
   "facts": {
    "registration": "verified",
    "parameters": "verified",
    "flags": "verified"
   }
  }
 },
 {
  "id": "ACT-0005",
  "kind": "action-type",
  "name": "set_variable",
  "title": "Variable setzen (Zuweisung)",
  "category": "runtime-action",
  "description": "Liest einen Wert aus einer Quelle und speichert ihn in einer Ziel-Variable.",
  "status": {
   "dev": "implementiert",
   "test": "nicht getestet",
   "doc": "entwurf"
  },
  "parameters": [
   {
    "name": "variableName",
    "label": "Ziel-Variable",
    "type": "variable",
    "source": "variables"
   },
   {
    "name": "value",
    "label": "Einfacher Wert (z.B. 555)",
    "type": "string",
    "placeholder": "Literal oder ${var}"
   },
   {
    "name": "source",
    "label": "(oder) Quell-Objekt / Variable",
    "type": "object",
    "source": "objects"
   },
   {
    "name": "sourceProperty",
    "label": "(oder) Eigenschaft (optional)",
    "type": "string",
    "placeholder": "z.B. text oder value"
   }
  ],
  "flags": {
   "hidden": true
  },
  "sources": {
   "code": [
    "src/runtime/ActionRegistry.ts",
    "src/runtime/actions/handlers/"
   ],
   "docs": [
    "docs/inventory/action-metadata.json",
    "docs/reference/actions.md"
   ]
  },
  "version": {
   "lastChecked": "2026-10-17",
   "extractedAt": "2026-10-18T10:54:39.412Z",
   "contentHash": "sha256:e20babdc1a0ecbc8"
  },
  "provenance": {
   "method": [
    "registry-extract"
   ],
   "confidence": "verified",
   "facts": {
    "registration": "verified",
    "parameters": "verified",
    "flags": "verified"
   }
  }
 },
 {
  "id": "ACT-0006",
  "kind": "action-type",
  "name": "calculate",
  "title": "Berechnung",
  "category": "runtime-action",
  "description": "Führt eine mathematische Berechnung aus.",
  "status": {
   "dev": "implementiert",
   "test": "nicht getestet",
   "doc": "entwurf"
  },
  "parameters": [
   {
    "name": "resultVariable",
    "label": "Ziel",
    "type": "variable",
    "source": "variables"
   },
   {
    "name": "formula",
    "label": "Wert",
    "type": "string",
    "multiline": true,
    "placeholder": "z.B. myVar := score + 10",
    "hint": "Ziel := Ausdruck, z.B. myVar := 5 + score"
   }
  ],
  "flags": {},
  "sources": {
   "code": [
    "src/runtime/ActionRegistry.ts",
    "src/runtime/actions/handlers/"
   ],
   "docs": [
    "docs/inventory/action-metadata.json",
    "docs/reference/actions.md"
   ]
  },
  "version": {
   "lastChecked": "2026-10-17",
   "extractedAt": "2026-10-18T10:54:39.412Z",
   "contentHash": "sha256:b048536bdb1deb29"
  },
  "provenance": {
   "method": [
    "registry-extract"
   ],
   "confidence": "verified",
   "facts": {
    "registration": "verified",
    "parameters": "verified",
    "flags": "verified"
   }
  }
 },
 {
  "id": "ACT-0007",
  "kind": "action-type",
  "name": "negate",
  "title": "Wert negieren",
  "category": "runtime-action",
  "description": "Negiert numerische Eigenschaften oder Variablen (- wird zu +, + wird zu -).",
  "status": {
   "dev": "implementiert",
   "test": "nicht getestet",
   "doc": "entwurf"
  },
  "parameters": [
   {
    "name": "changes",
    "label": "Zuweisungen",
    "type": "keyvalue",
    "hint": "Wähle Datenquellen (links) aus, die negiert werden sollen."
   }
  ],
  "flags": {},
  "sources": {
   "code": [
    "src/runtime/ActionRegistry.ts",
    "src/runtime/actions/handlers/"
   ],
   "docs": [
    "docs/inventory/action-metadata.json",
    "docs/reference/actions.md"
   ]
  },
  "version": {
   "lastChecked": "2026-10-17",
   "extractedAt": "2026-10-18T10:54:39.412Z",
   "contentHash": "sha256:1d3a40a778539d3c"
  },
  "provenance": {
   "method": [
    "registry-extract"
   ],
   "confidence": "verified",
   "facts": {
    "registration": "verified",
    "parameters": "verified",
    "flags": "verified"
   }
  }
 },
 {
  "id": "ACT-0008",
  "kind": "action-type",
  "name": "increment",
  "title": "Werte addieren",
  "category": "runtime-action",
  "description": "Addiert numerische Werte auf bestehende Variablen oder Eigenschaften.",
  "status": {
   "dev": "implementiert",
   "test": "nicht getestet",
   "doc": "entwurf"
  },
  "parameters": [
   {
    "name": "changes",
    "label": "Zuweisungen",
    "type": "keyvalue",
    "hint": "Wähle Datenquellen (links) und den Wert, der addiert werden soll (rechts)."
   }
  ],
  "flags": {},
  "sources": {
   "code": [
    "src/runtime/ActionRegistry.ts",
    "src/runtime/actions/handlers/"
   ],
   "docs": [
    "docs/inventory/action-metadata.json",
    "docs/reference/actions.md"
   ]
  },
  "version": {
   "lastChecked": "2026-10-17",
   "extractedAt": "2026-10-18T10:54:39.412Z",
   "contentHash": "sha256:47f1d029149cf08e"
  },
  "provenance": {
   "method": [
    "registry-extract"
   ],
   "confidence": "verified",
   "facts": {
    "registration": "verified",
    "parameters": "verified",
    "flags": "verified"
   }
  }
 },
 {
  "id": "ACT-0009",